{
  "schema": 1,
  "type_id": "xiaomi-band-11-4.100.139.type.file_operations.v1",
  "target_id": "xiaomi-band-11-4.100.139",
  "kind": "struct",
  "name": "file_operations",
  "size": 48,
  "alignment": 4,
  "fields": [
    {
      "name": "open",
      "offset": 0,
      "width": 4,
      "signedness": "pointer",
      "provenance": "exact sub_C1D06B0 internal fs_open path dispatches fops+0x00; this proves the slot only, not the withdrawn direct-call ABI"
    },
    {
      "name": "close",
      "offset": 4,
      "width": 4,
      "signedness": "pointer",
      "provenance": "exact sub_C1CEC08 file_close dispatches fops+0x04"
    },
    {
      "name": "read",
      "offset": 8,
      "width": 4,
      "signedness": "pointer",
      "provenance": "exact sub_C1D119C vectored-read path dispatches fops+0x08; this proves the slot only, not the withdrawn flat-buffer ABI"
    },
    {
      "name": "write",
      "offset": 12,
      "width": 4,
      "signedness": "pointer",
      "provenance": "exact sub_C1D2640 public fs_write path dispatches fops+0x0c"
    },
    {
      "name": "lseek",
      "offset": 16,
      "width": 4,
      "signedness": "pointer",
      "provenance": "exact sub_C1D0524 public fs_lseek path dispatches fops+0x10 and preserves an AAPCS-aligned int64_t offset"
    },
    {
      "name": "ioctl",
      "offset": 20,
      "width": 4,
      "signedness": "pointer",
      "provenance": "exact sub_C1CFF88 variadic file_ioctl path dispatches fops+0x14 with R1=request and an optional argument"
    }
  ],
  "provenance": {
    "firmware_sha256": "31ce82257f7c127950dc5070b86316730cf468a41f0d004559e41e7d923b2c74",
    "evidence_ids": [
      "EVID-VERIFY-4139-001"
    ],
    "source": "layout shape carried from same-model Xiaomi Band 11 analysis (4.100.108/043 recovered layout); pointer-free offsets are architecture-fixed (Cortex-M33/thumb2). Independent 4.100.139 field-offset audit pending."
  }
}
